{"$id":"provan.evidence_settlement.v1","$schema":"https://json-schema.org/draft/2020-12/schema","additionalProperties":false,"properties":{"conditional_activation":{"items":{"additionalProperties":false,"properties":{"basis":{"minLength":1,"type":"string"},"criterion_ref":{"minLength":1,"type":"string"},"evidence_refs":{"items":{"minLength":1,"type":"string"},"type":"array"},"reason_code":{"minLength":1,"type":"string"},"state":{"enum":["active","inactive","unresolved"]}},"required":["criterion_ref","state","basis","evidence_refs","reason_code"],"type":"object"},"type":"array"},"contract_ref":{"additionalProperties":false,"properties":{"id":{"minLength":1,"type":"string"},"sha256":{"pattern":"^sha256:[0-9a-f]{64}$","type":"string"}},"required":["id","sha256"],"type":"object"},"created_at":{"format":"date-time","type":"string"},"criteria":{"items":{"additionalProperties":false,"properties":{"closure_requirement_ref":{"additionalProperties":false,"properties":{"id":{"minLength":1,"type":"string"},"sha256":{"pattern":"^sha256:[0-9a-f]{64}$","type":"string"}},"required":["id","sha256"],"type":"object"},"considered_evidence":{"items":{"minLength":1,"type":"string"},"type":"array"},"contract_class":{"enum":["mandatory","conditional","not_applicable"]},"criterion_ref":{"minLength":1,"type":"string"},"eligible_evidence":{"items":{"additionalProperties":false,"properties":{"candidate_digest":{"pattern":"^sha256:[0-9a-f]{64}$","type":"string"},"closure_requirement_ref":{"minLength":1,"type":"string"},"evidence_class":{"enum":["source_verified","owner_confirmed","trusted_imported_receipt","model_reviewed"]},"evidence_id":{"pattern":"^sha256:[0-9a-f]{64}$","type":"string"},"predicate_result":{"enum":["supports","falsifies"]},"reason_code":{"minLength":1,"type":"string"},"source":{"minLength":1,"type":"string"}},"required":["evidence_id","evidence_class","source","candidate_digest","closure_requirement_ref","predicate_result","reason_code"],"type":"object"},"type":"array"},"material":{"type":"boolean"},"missing_evidence":{"items":{"minLength":1,"type":"string"},"type":"array"},"missing_evidence_as_basis":{"const":false},"reason_codes":{"items":{"minLength":1,"type":"string"},"type":"array"},"required_evidence_class":{"minLength":1,"type":"string"},"state":{"enum":["established","falsified","disputed","not_established","not_applicable"]},"supporting_ineligible_evidence":{"type":"array"}},"required":["criterion_ref","contract_class","required_evidence_class","considered_evidence","eligible_evidence","supporting_ineligible_evidence","state","reason_codes","closure_requirement_ref","missing_evidence","missing_evidence_as_basis","material"],"type":"object"},"minItems":1,"type":"array"},"effective_status":{"enum":["active","expired"]},"freeze_ref":{"additionalProperties":false,"properties":{"id":{"minLength":1,"type":"string"},"sha256":{"pattern":"^sha256:[0-9a-f]{64}$","type":"string"}},"required":["id","sha256"],"type":"object"},"recommendation":{"enum":["cleared","held","not_eligible"]},"schema_id":{"const":"provan.evidence_settlement.v1"},"settlement_id":{"format":"uuid","type":"string"}},"required":["schema_id","settlement_id","contract_ref","freeze_ref","conditional_activation","criteria","recommendation","effective_status","created_at"],"type":"object"}
