{"conditional_activation":[],"contract_ref":{"id":"ab67232e-d00c-483b-9ff7-d74660e527e3","sha256":"sha256:686cf1af2c678388d0ef6897e7249cfd67cb4b4748a54bd63b4f1563eb2f37a0"},"created_at":"2026-08-10T12:00:00Z","criteria":[{"closure_requirement_ref":{"id":"3aa6a3c6-dc75-45d9-b656-5f38aecd6eb0","sha256":"sha256:034ab155d286eb4ae240d5054448041f1abfaf7626f88084266d5b438271a9d5"},"considered_evidence":["sha256:8d04f6e8681d1442ca89eaa4b0d2ea07d0616399bdc756eceb4561e69089cce4"],"contract_class":"mandatory","criterion_ref":"session11.readme.present","eligible_evidence":[{"candidate_digest":"sha256:4a3eae07da5c0f87782b2b6b3e0083257add28496a1921a1f72eb6a0b61add76","closure_requirement_ref":"3aa6a3c6-dc75-45d9-b656-5f38aecd6eb0","evidence_class":"source_verified","evidence_id":"sha256:8d04f6e8681d1442ca89eaa4b0d2ea07d0616399bdc756eceb4561e69089cce4","predicate_result":"supports","reason_code":"SOURCE_PREDICATE_SATISFIED","source":"provan_source_only_evaluator"}],"material":true,"missing_evidence":[],"missing_evidence_as_basis":false,"reason_codes":["ELIGIBLE_EVIDENCE_ESTABLISHED"],"required_evidence_class":"source_verified","state":"established","supporting_ineligible_evidence":[]}],"effective_status":"active","freeze_ref":{"id":"1227491b-e4a3-42be-a2b3-fc10dc2c9646","sha256":"sha256:61ded1226954a0b50e928a3c2467458d7a949ab789ddb445d264812d0a69c156"},"recommendation":"held","schema_id":"provan.evidence_settlement.v1","settlement_id":"50b5cc13-352f-4652-b744-12a5ef52e636"}
